NACE_CODE_1;NACE_CODE_2;NACE-Level;NACE Category Name;DIT Main Category;DIT Sub Category;DIT.ID.x
C1105;C11.05;4;Manufacture of beer;Manufacturing ;Manufacturing of Food Products;1206
C1106;C11.06;4;Manufacture of malt;Manufacturing ;Manufacturing of Food Products;1206
C1107;C11.07;4;"Manufacture of soft drinks; production of mineral waters and other bottled waters";Manufacturing ;Manufacturing of Food Products;1206
C12;C12;2;Manufacture of tobacco products;Manufacturing ;Manufacturing of Food Products;1206
C120;C12.0;3;Manufacture of tobacco products;Manufacturing ;Manufacturing of Food Products;1206
C1200;C12.00;4;Manufacture of tobacco products;Manufacturing ;Manufacturing of Food Products;1206
C2893;C28.93;4;Manufacture of machinery for food, beverage and tobacco processing;Manufacturing ;Manufacturing of Food Products;1206
C275;C27.5;3;Manufacture of domestic appliances;Manufacturing ;"Manufacturing of Furniture and Appliances
";1207
C2751;C27.51;4;Manufacture of electric domestic appliances;Manufacturing ;"Manufacturing of Furniture and Appliances
";1207
C2752;C27.52;4;Manufacture of non-electric domestic appliances;Manufacturing ;"Manufacturing of Furniture and Appliances
";1207
C2823;C28.23;4;Manufacture of office machinery and equipment (except computers and peripheral equipment);Manufacturing ;"Manufacturing of Furniture and Appliances
";1207
C31;C31;2;Manufacture of furniture;Manufacturing ;"Manufacturing of Furniture and Appliances
";1207
C310;C31.0;3;Manufacture of furniture;Manufacturing ;"Manufacturing of Furniture and Appliances
";1207
C3101;C31.01;4;Manufacture of office and shop furniture;Manufacturing ;"Manufacturing of Furniture and Appliances
";1207
C3102;C31.02;4;Manufacture of kitchen furniture;Manufacturing ;"Manufacturing of Furniture and Appliances
";1207
C3103;C31.03;4;Manufacture of mattresses;Manufacturing ;"Manufacturing of Furniture and Appliances
";1207
C3109;C31.09;4;Manufacture of other furniture;Manufacturing ;"Manufacturing of Furniture and Appliances
";1207
C21;C21;2;Manufacture of basic pharmaceutical products and pharmaceutical preparations;Manufacturing ;Manufacturing of Healthcare and Medical products;1208
C211;C21.1;3;Manufacture of basic pharmaceutical products;Manufacturing ;Manufacturing of Healthcare and Medical products;1208
C2110;C21.10;4;Manufacture of basic pharmaceutical products;Manufacturing ;Manufacturing of Healthcare and Medical products;1208
C212;C21.2;3;Manufacture of pharmaceutical preparations;Manufacturing ;Manufacturing of Healthcare and Medical products;1208
C2120;C21.20;4;Manufacture of pharmaceutical preparations;Manufacturing ;Manufacturing of Healthcare and Medical products;1208
C266;C26.6;3;Manufacture of irradiation, electromedical and electrotherapeutic equipment;Manufacturing ;Manufacturing of Healthcare and Medical products;1208
C2660;C26.60;4;Manufacture of irradiation, electromedical and electrotherapeutic equipment;Manufacturing ;Manufacturing of Healthcare and Medical products;1208
C325;C32.5;3;Manufacture of medical and dental instruments and supplies;Manufacturing ;Manufacturing of Healthcare and Medical products;1208
C3250;C32.50;4;Manufacture of medical and dental instruments and supplies;Manufacturing ;Manufacturing of Healthcare and Medical products;1208
C26;C26;2;Manufacture of computer, electronic and optical products;Manufacturing ;Manufacturing of Information Technology and Telecommunications Goods;1209
C261;C26.1;3;Manufacture of electronic components and boards;Manufacturing ;Manufacturing of Information Technology and Telecommunications Goods;1209
C2611;C26.11;4;Manufacture of electronic components;Manufacturing ;Manufacturing of Information Technology and Telecommunications Goods;1209
C2612;C26.12;4;Manufacture of loaded electronic boards;Manufacturing ;Manufacturing of Information Technology and Telecommunications Goods;1209
C262;C26.2;3;Manufacture of computers and peripheral equipment;Manufacturing ;Manufacturing of Information Technology and Telecommunications Goods;1209
C2620;C26.20;4;Manufacture of computers and peripheral equipment;Manufacturing ;Manufacturing of Information Technology and Telecommunications Goods;1209
C263;C26.3;3;Manufacture of communication equipment;Manufacturing ;Manufacturing of Information Technology and Telecommunications Goods;1209
C2630;C26.30;4;Manufacture of communication equipment;Manufacturing ;Manufacturing of Information Technology and Telecommunications Goods;1209
C264;C26.4;3;Manufacture of consumer electronics;Manufacturing ;Manufacturing of Information Technology and Telecommunications Goods;1209
C2640;C26.40;4;Manufacture of consumer electronics;Manufacturing ;Manufacturing of Information Technology and Telecommunications Goods;1209
C322;C32.2;3;Manufacture of musical instruments;Manufacturing ;Manufacturing of Leisure Equipment;1210
C3220;C32.20;4;Manufacture of musical instruments;Manufacturing ;Manufacturing of Leisure Equipment;1210
C323;C32.3;3;Manufacture of sports goods;Manufacturing ;Manufacturing of Leisure Equipment;1210
C3230;C32.30;4;Manufacture of sports goods;Manufacturing ;Manufacturing of Leisure Equipment;1210
C324;C32.4;3;Manufacture of games and toys;Manufacturing ;Manufacturing of Leisure Equipment;1210
C3240;C32.40;4;Manufacture of games and toys;Manufacturing ;Manufacturing of Leisure Equipment;1210
C281;C28.1;3;Manufacture of general-purpose machinery;Manufacturing ;Manufacturing of Machinery and Equipment;1211
C2811;C28.11;4;Manufacture of engines and turbines, except aircraft, vehicle and cycle engines;Manufacturing ;Manufacturing of Machinery and Equipment;1211
C2812;C28.12;4;Manufacture of fluid power equipment;Manufacturing ;Manufacturing of Machinery and Equipment;1211
C2813;C28.13;4;Manufacture of other pumps and compressors;Manufacturing ;Manufacturing of Machinery and Equipment;1211
C2814;C28.14;4;Manufacture of other taps and valves;Manufacturing ;Manufacturing of Machinery and Equipment;1211
C2815;C28.15;4;Manufacture of bearings, gears, gearing and driving elements;Manufacturing ;Manufacturing of Machinery and Equipment;1211
C282;C28.2;3;Manufacture of other general-purpose machinery;Manufacturing ;Manufacturing of Machinery and Equipment;1211
C2821;C28.21;4;Manufacture of ovens, furnaces and furnace burners;Manufacturing ;Manufacturing of Machinery and Equipment;1211
C2822;C28.22;4;Manufacture of lifting and handling equipment;Manufacturing ;Manufacturing of Machinery and Equipment;1211
C2829;C28.29;4;Manufacture of other general-purpose machinery n.e.c.;Manufacturing ;Manufacturing of Machinery and Equipment;1211
C284;C28.4;3;Manufacture of metal forming machinery and machine tools;Manufacturing ;Manufacturing of Machinery and Equipment;1211
C2841;C28.41;4;Manufacture of metal forming machinery;Manufacturing ;Manufacturing of Machinery and Equipment;1211
C2849;C28.49;4;Manufacture of other machine tools;Manufacturing ;Manufacturing of Machinery and Equipment;1211
C2891;C28.91;4;Manufacture of machinery for metallurgy;Manufacturing ;Manufacturing of Machinery and Equipment;1211
C2895;C28.95;4;Manufacture of machinery for paper and paperboard production;Manufacturing ;Manufacturing of Machinery and Equipment;1211
C2896;C28.96;4;Manufacture of plastics and rubber machinery;Manufacturing ;Manufacturing of Machinery and Equipment;1211
C2899;C28.99;4;Manufacture of other special-purpose machinery n.e.c.;Manufacturing ;Manufacturing of Machinery and Equipment;1211
C251;C25.1;3;Manufacture of structural metal products;Manufacturing ;Manufacturing of Metal Products;1212
C2511;C25.11;4;Manufacture of metal structures and parts of structures;Manufacturing ;Manufacturing of Metal Products;1212
C254;C25.4;3;Manufacture of weapons and ammunition;Manufacturing ;Manufacturing of Metal Products;1212
C2540;C25.40;4;Manufacture of weapons and ammunition;Manufacturing ;Manufacturing of Metal Products;1212
C255;C25.5;3;"Forging, pressing, stamping and roll-forming of metal; powder metallurgy";Manufacturing ;Manufacturing of Metal Products;1212
C2550;C25.50;4;"Forging, pressing, stamping and roll-forming of metal; powder metallurgy";Manufacturing ;Manufacturing of Metal Products;1212
C256;C25.6;3;"Treatment and coating of metals; machining";Manufacturing ;Manufacturing of Metal Products;1212
C2561;C25.61;4;Treatment and coating of metals;Manufacturing ;Manufacturing of Metal Products;1212
C2562;C25.62;4;Machining;Manufacturing ;Manufacturing of Metal Products;1212
C257;C25.7;3;Manufacture of cutlery, tools and general hardware;Manufacturing ;Manufacturing of Metal Products;1212
C2571;C25.71;4;Manufacture of cutlery;Manufacturing ;Manufacturing of Metal Products;1212
C2573;C25.73;4;Manufacture of tools;Manufacturing ;Manufacturing of Metal Products;1212
C259;C25.9;3;Manufacture of other fabricated metal products;Manufacturing ;Manufacturing of Metal Products;1212
C2593;C25.93;4;Manufacture of wire products, chain and springs;Manufacturing ;Manufacturing of Metal Products;1212
C2594;C25.94;4;Manufacture of fasteners and screw machine products;Manufacturing ;Manufacturing of Metal Products;1212
C2599;C25.99;4;Manufacture of other fabricated metal products n.e.c.;Manufacturing ;Manufacturing of Metal Products;1212
C2211;C22.11;4;"Manufacture of rubber tyres and tubes; retreading and rebuilding of rubber tyres";Manufacturing ;Manufacturing of Motor Vehicles;1213
C29;C29;2;Manufacture of motor vehicles, trailers and semi-trailers;Manufacturing ;Manufacturing of Motor Vehicles;1213
C291;C29.1;3;Manufacture of motor vehicles;Manufacturing ;Manufacturing of Motor Vehicles;1213
C2910;C29.10;4;Manufacture of motor vehicles;Manufacturing ;Manufacturing of Motor Vehicles;1213
C292;C29.2;3;"Manufacture of bodies (coachwork) for motor vehicles; manufacture of trailers and semi-trailers";Manufacturing ;Manufacturing of Motor Vehicles;1213
C2920;C29.20;4;"Manufacture of bodies (coachwork) for motor vehicles; manufacture of trailers and semi-trailers";Manufacturing ;Manufacturing of Motor Vehicles;1213
C293;C29.3;3;Manufacture of parts and accessories for motor vehicles;Manufacturing ;Manufacturing of Motor Vehicles;1213
C2931;C29.31;4;Manufacture of electrical and electronic equipment for motor vehicles;Manufacturing ;Manufacturing of Motor Vehicles;1213
C2932;C29.32;4;Manufacture of other parts and accessories for motor vehicles;Manufacturing ;Manufacturing of Motor Vehicles;1213
C3211;C32.11;4;Striking of coins;Manufacturing ;Manufacturing of Non-Electrical Consumer Goods;1214
C3299;C32.99;4;Other manufacturing n.e.c.;Manufacturing ;Manufacturing of Non-Electrical Consumer Goods;1214
C22;C22;2;Manufacture of rubber and plastic products;Manufacturing ;Manufacturing of Raw Materials and Parts;1215
C221;C22.1;3;Manufacture of rubber products;Manufacturing ;Manufacturing of Raw Materials and Parts;1215
C2219;C22.19;4;Manufacture of other rubber products;Manufacturing ;Manufacturing of Raw Materials and Parts;1215
C222;C22.2;3;Manufacture of plastics products;Manufacturing ;Manufacturing of Raw Materials and Parts;1215
C2221;C22.21;4;Manufacture of plastic plates, sheets, tubes and profiles;Manufacturing ;Manufacturing of Raw Materials and Parts;1215
C2222;C22.22;4;Manufacture of plastic packing goods;Manufacturing ;Manufacturing of Raw Materials and Parts;1215
C2229;C22.29;4;Manufacture of other plastic products;Manufacturing ;Manufacturing of Raw Materials and Parts;1215
C23;C23;2;Manufacture of other non-metallic mineral products;Manufacturing ;Manufacturing of Raw Materials and Parts;1215
C231;C23.1;3;Manufacture of glass and glass products;Manufacturing ;Manufacturing of Raw Materials and Parts;1215
C2311;C23.11;4;Manufacture of flat glass;Manufacturing ;Manufacturing of Raw Materials and Parts;1215
C2312;C23.12;4;Shaping and processing of flat glass;Manufacturing ;Manufacturing of Raw Materials and Parts;1215
C2313;C23.13;4;Manufacture of hollow glass;Manufacturing ;Manufacturing of Raw Materials and Parts;1215
C2314;C23.14;4;Manufacture of glass fibres;Manufacturing ;Manufacturing of Raw Materials and Parts;1215
C2319;C23.19;4;Manufacture and processing of other glass, including technical glassware;Manufacturing ;Manufacturing of Raw Materials and Parts;1215
C232;C23.2;3;Manufacture of refractory products;Manufacturing ;Manufacturing of Raw Materials and Parts;1215
C2320;C23.20;4;Manufacture of refractory products;Manufacturing ;Manufacturing of Raw Materials and Parts;1215
C234;C23.4;3;Manufacture of other porcelain and ceramic products;Manufacturing ;Manufacturing of Raw Materials and Parts;1215
C2341;C23.41;4;Manufacture of ceramic household and ornamental articles;Manufacturing ;Manufacturing of Raw Materials and Parts;1215
C2344;C23.44;4;Manufacture of other technical ceramic products;Manufacturing ;Manufacturing of Raw Materials and Parts;1215
C2349;C23.49;4;Manufacture of other ceramic products;Manufacturing ;Manufacturing of Raw Materials and Parts;1215
C239;C23.9;3;Manufacture of abrasive products and non-metallic mineral products n.e.c.;Manufacturing ;Manufacturing of Raw Materials and Parts;1215
C2391;C23.91;4;Production of abrasive products;Manufacturing ;Manufacturing of Raw Materials and Parts;1215
C2399;C23.99;4;Manufacture of other non-metallic mineral products n.e.c.;Manufacturing ;Manufacturing of Raw Materials and Parts;1215
C24;C24;2;Manufacture of basic metals;Manufacturing ;Manufacturing of Raw Materials and Parts;1215
C241;C24.1;3;Manufacture of basic iron and steel and of ferro-alloys;Manufacturing ;Manufacturing of Raw Materials and Parts;1215
C2410;C24.10;4;Manufacture of basic iron and steel and of ferro-alloys;Manufacturing ;Manufacturing of Raw Materials and Parts;1215
C242;C24.2;3;Manufacture of tubes, pipes, hollow profiles and related fittings, of steel;Manufacturing ;Manufacturing of Raw Materials and Parts;1215
C2420;C24.20;4;Manufacture of tubes, pipes, hollow profiles and related fittings, of steel;Manufacturing ;Manufacturing of Raw Materials and Parts;1215
C243;C24.3;3;Manufacture of other products of first processing of steel;Manufacturing ;Manufacturing of Raw Materials and Parts;1215
C2431;C24.31;4;Cold drawing of bars;Manufacturing ;Manufacturing of Raw Materials and Parts;1215
C2432;C24.32;4;Cold rolling of narrow strip;Manufacturing ;Manufacturing of Raw Materials and Parts;1215
C2433;C24.33;4;Cold forming or folding;Manufacturing ;Manufacturing of Raw Materials and Parts;1215
C2434;C24.34;4;Cold drawing of wire;Manufacturing ;Manufacturing of Raw Materials and Parts;1215
C244;C24.4;3;Manufacture of basic precious and other non-ferrous metals;Manufacturing ;Manufacturing of Raw Materials and Parts;1215
C2441;C24.41;4;Precious metals production;Manufacturing ;Manufacturing of Raw Materials and Parts;1215
C2442;C24.42;4;Aluminium production;Manufacturing ;Manufacturing of Raw Materials and Parts;1215
C2443;C24.43;4;Lead, zinc and tin production;Manufacturing ;Manufacturing of Raw Materials and Parts;1215
C2444;C24.44;4;Copper production;Manufacturing ;Manufacturing of Raw Materials and Parts;1215
C2445;C24.45;4;Other non-ferrous metal production;Manufacturing ;Manufacturing of Raw Materials and Parts;1215
C2446;C24.46;4;Processing of nuclear fuel;Manufacturing ;Manufacturing of Raw Materials and Parts;1215
C245;C24.5;3;Casting of metals;Manufacturing ;Manufacturing of Raw Materials and Parts;1215
C2451;C24.51;4;Casting of iron;Manufacturing ;Manufacturing of Raw Materials and Parts;1215
C2452;C24.52;4;Casting of steel;Manufacturing ;Manufacturing of Raw Materials and Parts;1215
C2453;C24.53;4;Casting of light metals;Manufacturing ;Manufacturing of Raw Materials and Parts;1215
C2454;C24.54;4;Casting of other non-ferrous metals;Manufacturing ;Manufacturing of Raw Materials and Parts;1215
C2591;C25.91;4;Manufacture of steel drums and similar containers;Manufacturing ;Manufacturing of Transportation Equipment;1216
C2592;C25.92;4;Manufacture of light metal packaging;Manufacturing ;Manufacturing of Transportation Equipment;1216
C30;C30;2;Manufacture of other transport equipment;Manufacturing ;Manufacturing of Transportation Equipment;1216
C301;C30.1;3;Building of ships and boats;Manufacturing ;Manufacturing of Transportation Equipment;1216
C3011;C30.11;4;Building of ships and floating structures;Manufacturing ;Manufacturing of Transportation Equipment;1216
C3012;C30.12;4;Building of pleasure and sporting boats;Manufacturing ;Manufacturing of Transportation Equipment;1216
C302;C30.2;3;Manufacture of railway locomotives and rolling stock;Manufacturing ;Manufacturing of Transportation Equipment;1216
C3020;C30.20;4;Manufacture of railway locomotives and rolling stock;Manufacturing ;Manufacturing of Transportation Equipment;1216
C303;C30.3;3;Manufacture of air and spacecraft and related machinery;Manufacturing ;Manufacturing of Transportation Equipment;1216
C3030;C30.30;4;Manufacture of air and spacecraft and related machinery;Manufacturing ;Manufacturing of Transportation Equipment;1216
C304;C30.4;3;Manufacture of military fighting vehicles;Manufacturing ;Manufacturing of Transportation Equipment;1216
C3040;C30.40;4;Manufacture of military fighting vehicles;Manufacturing ;Manufacturing of Transportation Equipment;1216
C309;C30.9;3;Manufacture of transport equipment n.e.c.;Manufacturing ;Manufacturing of Transportation Equipment;1216
C3091;C30.91;4;Manufacture of motorcycles;Manufacturing ;Manufacturing of Transportation Equipment;1216
C3092;C30.92;4;Manufacture of bicycles and invalid carriages;Manufacturing ;Manufacturing of Transportation Equipment;1216
C3099;C30.99;4;Manufacture of other transport equipment n.e.c.;Manufacturing ;Manufacturing of Transportation Equipment;1216
C1629;C16.29;4;"Manufacture of other products of wood; manufacture of articles of cork, straw and plaiting materials";Manufacturing ;Manufacturing of Wood and Paper Products;1217
C171;C17.1;3;Manufacture of pulp, paper and paperboard;Manufacturing ;Manufacturing of Wood and Paper Products;1217
C1711;C17.11;4;Manufacture of pulp;Manufacturing ;Manufacturing of Wood and Paper Products;1217
C1712;C17.12;4;Manufacture of paper and paperboard;Manufacturing ;Manufacturing of Wood and Paper Products;1217
C1722;C17.22;4;Manufacture of household and sanitary goods and of toilet requisites;Manufacturing ;Manufacturing of Wood and Paper Products;1217
C1723;C17.23;4;Manufacture of paper stationery;Manufacturing ;Manufacturing of Wood and Paper Products;1217
C1729;C17.29;4;Manufacture of other articles of paper and paperboard;Manufacturing ;Manufacturing of Wood and Paper Products;1217
No Nace;No Nace;No Nace;No Nace;Automotive;Other (Automotive);1299
D;D;1;Electricity, gas, steam and air conditioning supply;Energy and Utility Suppliers;;1300
E;E;1;"Water supply; sewerage; waste managment and remediation activities";Energy and Utility Suppliers;;1300
C253;C25.3;3;Manufacture of steam generators, except central heating hot water boilers;Energy and Utility Suppliers;Electricity;1301
C2530;C25.30;4;Manufacture of steam generators, except central heating hot water boilers;Energy and Utility Suppliers;Electricity;1301
C2712;C27.12;4;Manufacture of electricity distribution and control apparatus;Energy and Utility Suppliers;Electricity;1301
D351;D35.1;3;Electric power generation, transmission and distribution;Energy and Utility Suppliers;Electricity;1301
D3511;D35.11;4;Production of electricity;Energy and Utility Suppliers;Electricity;1301
D3512;D35.12;4;Transmission of electricity;Energy and Utility Suppliers;Electricity;1301
D3513;D35.13;4;Distribution of electricity;Energy and Utility Suppliers;Electricity;1301
D3514;D35.14;4;Trade of electricity;Energy and Utility Suppliers;Electricity;1301
D353;D35.3;3;Steam and air conditioning supply;Energy and Utility Suppliers;Electricity;1301
D3530;D35.30;4;Steam and air conditioning supply;Energy and Utility Suppliers;Electricity;1301
D352;D35.2;3;"Manufacture of gas; distribution of gaseous fuels through mains";Energy and Utility Suppliers;Gas;1302
D3521;D35.21;4;Manufacture of gas;Energy and Utility Suppliers;Gas;1302
D3522;D35.22;4;Distribution of gaseous fuels through mains;Energy and Utility Suppliers;Gas;1302
D3523;D35.23;4;Trade of gas through mains;Energy and Utility Suppliers;Gas;1302
G4671;G46.71;4;Wholesale of solid, liquid and gaseous fuels and related products;Energy and Utility Suppliers;Gas;1302
E36;E36;2;Water collection, treatment and supply;Energy and Utility Suppliers;Water Supply;1303
E360;E36.0;3;Water collection, treatment and supply;Energy and Utility Suppliers;Water Supply;1303
E3600;E36.00;4;Water collection, treatment and supply;Energy and Utility Suppliers;Water Supply;1303
E37;E37;2;Sewerage;Energy and Utility Suppliers;Water Supply;1303
E370;E37.0;3;Sewerage;Energy and Utility Suppliers;Water Supply;1303
E3700;E37.00;4;Sewerage;Energy and Utility Suppliers;Water Supply;1303
E38;E38;2;"Waste collection, treatment and disposal activities; materials recovery";Energy and Utility Suppliers;Waste Collection, Treatment and Disposal Activities;1304
E381;E38.1;3;Waste collection;Energy and Utility Suppliers;Waste Collection, Treatment and Disposal Activities;1304
E3811;E38.11;4;Collection of non-hazardous waste;Energy and Utility Suppliers;Waste Collection, Treatment and Disposal Activities;1304
E3812;E38.12;4;Collection of hazardous waste;Energy and Utility Suppliers;Waste Collection, Treatment and Disposal Activities;1304
E382;E38.2;3;Waste treatment and disposal;Energy and Utility Suppliers;Waste Collection, Treatment and Disposal Activities;1304
E3821;E38.21;4;Treatment and disposal of non-hazardous waste;Energy and Utility Suppliers;Waste Collection, Treatment and Disposal Activities;1304
E3822;E38.22;4;Treatment and disposal of hazardous waste;Energy and Utility Suppliers;Waste Collection, Treatment and Disposal Activities;1304
E383;E38.3;3;Materials recovery;Energy and Utility Suppliers;Waste Collection, Treatment and Disposal Activities;1304
E3831;E38.31;4;Dismantling of wrecks;Energy and Utility Suppliers;Waste Collection, Treatment and Disposal Activities;1304
E3832;E38.32;4;Recovery of sorted materials;Energy and Utility Suppliers;Waste Collection, Treatment and Disposal Activities;1304
E39;E39;2;Remediation activities and other waste management services;Energy and Utility Suppliers;Waste Collection, Treatment and Disposal Activities;1304
E390;E39.0;3;Remediation activities and other waste management services;Energy and Utility Suppliers;Waste Collection, Treatment and Disposal Activities;1304
E3900;E39.00;4;Remediation activities and other waste management services;Energy and Utility Suppliers;Waste Collection, Treatment and Disposal Activities;1304
G4677;G46.77;4;Wholesale of waste and scrap;Energy and Utility Suppliers;Waste Collection, Treatment and Disposal Activities;1304
F;F;1;Construction;Construction;;1400
M7111;M71.11;4;Architectural activities;Construction;Architects & Planners;1401
F41;F41;2;Construction of buildings;Construction;Development of Building Projects;1402
F411;F41.1;3;Development of building projects;Construction;Development of Building Projects;1402
F4110;F41.10;4;Development of building projects;Construction;Development of Building Projects;1402
F412;F41.2;3;Construction of residential and non-residential buildings;Construction;Development of Building Projects;1402
F4120;F41.20;4;Construction of residential and non-residential buildings;Construction;Development of Building Projects;1402
F431;F43.1;3;Demolition and site preparation;Construction;Development of Building Projects;1402
F4311;F43.11;4;Demolition;Construction;Development of Building Projects;1402
F4312;F43.12;4;Site preparation;Construction;Development of Building Projects;1402
F4313;F43.13;4;Test drilling and boring;Construction;Development of Building Projects;1402
F42;F42;2;Civil engineering;Construction;Development of Infrastructure Projects;1403
F421;F42.1;3;Construction of roads and railways;Construction;Development of Infrastructure Projects;1403
F4211;F42.11;4;Construction of roads and motorways;Construction;Development of Infrastructure Projects;1403
F4212;F42.12;4;Construction of railways and underground railways;Construction;Development of Infrastructure Projects;1403
F4213;F42.13;4;Construction of bridges and tunnels;Construction;Development of Infrastructure Projects;1403
F422;F42.2;3;Construction of utility projects;Construction;Development of Infrastructure Projects;1403
F4221;F42.21;4;Construction of utility projects for fluids;Construction;Development of Infrastructure Projects;1403
F4222;F42.22;4;Construction of utility projects for electricity and telecommunications;Construction;Development of Infrastructure Projects;1403
F429;F42.9;3;Construction of other civil engineering projects;Construction;Development of Infrastructure Projects;1403
F4291;F42.91;4;Construction of water projects;Construction;Development of Infrastructure Projects;1403
F4299;F42.99;4;Construction of other civil engineering projects n.e.c.;Construction;Development of Infrastructure Projects;1403
F4321;F43.21;4;Electrical installation;Construction;Electrical Installation;1404
F4322;F43.22;4;Plumbing, heat and air-conditioning installation;Construction;Plumbing, Heating and Air-Conditioning Installation;1405
F4391;F43.91;4;Roofing activities;Construction;Roofing Activities;1406
F4334;F43.34;4;Painting and glazing;Construction;Painting and Glazing;1407
F4333;F43.33;4;Floor and wall covering;Construction;Floor and Wall Covering;1408
F4331;F43.31;4;Plastering;Construction;Plastering;1409
F4332;F43.32;4;Joinery installation;Construction;Joinery Installation;1410
N7732;N77.32;4;Renting and leasing of construction and civil engineering machinery and equipment;Construction;Rental of Construction and Earthmoving Machinery;1411
N7739;N77.39;4;Renting and leasing of other machinery, equipment and tangible goods n.e.c.;Construction;Rental of Construction and Earthmoving Machinery;1411
