NACE_CODE_1;NACE_CODE_2;NACE-Level;NACE Category Name;DIT Main Category;DIT Sub Category;DIT.ID.x
A;A;1;Agriculture,forestry and fishing;Agriculture, Forestry, Fishing;;1000
A1;A1;2;Crop and animal production, hunting and related service activities;Agriculture, Forestry, Fishing;Agriculture;1001
A11;A1.1;3;Growing of non-perennial crops;Agriculture, Forestry, Fishing;Agriculture;1001
A111;A1.11;4;Growing of cereals (except rice), leguminous crops and oil seeds;Agriculture, Forestry, Fishing;Agriculture;1001
A112;A1.12;4;Growing of rice;Agriculture, Forestry, Fishing;Agriculture;1001
A113;A1.13;4;Growing of vegetables and melons, roots and tubers;Agriculture, Forestry, Fishing;Agriculture;1001
A114;A1.14;4;Growing of sugar cane;Agriculture, Forestry, Fishing;Agriculture;1001
A115;A1.15;4;Growing of tobacco;Agriculture, Forestry, Fishing;Agriculture;1001
A116;A1.16;4;Growing of fibre crops;Agriculture, Forestry, Fishing;Agriculture;1001
A119;A1.19;4;Growing of other non-perennial crops;Agriculture, Forestry, Fishing;Agriculture;1001
A12;A1.2;3;Growing of perennial crops;Agriculture, Forestry, Fishing;Agriculture;1001
A121;A1.21;4;Growing of grapes;Agriculture, Forestry, Fishing;Agriculture;1001
A122;A1.22;4;Growing of tropical and subtropical fruits;Agriculture, Forestry, Fishing;Agriculture;1001
A123;A1.23;4;Growing of citrus fruits;Agriculture, Forestry, Fishing;Agriculture;1001
A124;A1.24;4;Growing of pome fruits and stone fruits;Agriculture, Forestry, Fishing;Agriculture;1001
A125;A1.25;4;Growing of other tree and bush fruits and nuts;Agriculture, Forestry, Fishing;Agriculture;1001
A126;A1.26;4;Growing of oleaginous fruits;Agriculture, Forestry, Fishing;Agriculture;1001
A127;A1.27;4;Growing of beverage crops;Agriculture, Forestry, Fishing;Agriculture;1001
A128;A1.28;4;Growing of spices, aromatic, drug and pharmaceutical crops;Agriculture, Forestry, Fishing;Agriculture;1001
A129;A1.29;4;Growing of other perennial crops;Agriculture, Forestry, Fishing;Agriculture;1001
A13;A1.3;3;Plant propagation;Agriculture, Forestry, Fishing;Agriculture;1001
A130;A1.30;4;Plant propagation;Agriculture, Forestry, Fishing;Agriculture;1001
A14;A1.4;3;Animal production;Agriculture, Forestry, Fishing;Agriculture;1001
A141;A1.41;4;Raising of dairy cattle;Agriculture, Forestry, Fishing;Agriculture;1001
A142;A1.42;4;Raising of other cattle and buffaloes;Agriculture, Forestry, Fishing;Agriculture;1001
A143;A1.43;4;Raising of horses and other equines;Agriculture, Forestry, Fishing;Agriculture;1001
A144;A1.44;4;Raising of camels and camelids;Agriculture, Forestry, Fishing;Agriculture;1001
A145;A1.45;4;Raising of sheep and goats;Agriculture, Forestry, Fishing;Agriculture;1001
A146;A1.46;4;Raising of swine/pigs;Agriculture, Forestry, Fishing;Agriculture;1001
A147;A1.47;4;Raising of poultry;Agriculture, Forestry, Fishing;Agriculture;1001
A149;A1.49;4;Raising of other animals;Agriculture, Forestry, Fishing;Agriculture;1001
A15;A1.5;3;Mixed farming;Agriculture, Forestry, Fishing;Agriculture;1001
A150;A1.50;4;Mixed farming;Agriculture, Forestry, Fishing;Agriculture;1001
A16;A1.6;3;Support activities to agriculture and post-harvest crop activities;Agriculture, Forestry, Fishing;Agriculture;1001
A161;A1.61;4;Support activities for crop production;Agriculture, Forestry, Fishing;Agriculture;1001
A162;A1.62;4;Support activities for animal production;Agriculture, Forestry, Fishing;Agriculture;1001
A163;A1.63;4;Post-harvest crop activities;Agriculture, Forestry, Fishing;Agriculture;1001
A164;A1.64;4;Seed processing for propagation;Agriculture, Forestry, Fishing;Agriculture;1001
A17;A1.7;3;Hunting, trapping and related service activities;Agriculture, Forestry, Fishing;Agriculture;1001
A170;A1.70;4;Hunting, trapping and related service activities;Agriculture, Forestry, Fishing;Agriculture;1001
N7731;N77.31;4;Renting and leasing of agricultural machinery and equipment;Agriculture, Forestry, Fishing;Agriculture;1001
A3;A3;2;Fishing and aquaculture;Agriculture, Forestry, Fishing;Fishing;1002
A31;A3.1;3;Fishing;Agriculture, Forestry, Fishing;Fishing;1002
A311;A3.11;4;Marine fishing;Agriculture, Forestry, Fishing;Fishing;1002
A312;A3.12;4;Freshwater fishing;Agriculture, Forestry, Fishing;Fishing;1002
A32;A3.2;3;Aquaculture;Agriculture, Forestry, Fishing;Fishing;1002
A321;A3.21;4;Marine aquaculture;Agriculture, Forestry, Fishing;Fishing;1002
A322;A3.22;4;Freshwater aquaculture;Agriculture, Forestry, Fishing;Fishing;1002
A2;A2;2;Forestry and logging;Agriculture, Forestry, Fishing;Forestry;1003
A21;A2.1;3;Silviculture and other forestry activities;Agriculture, Forestry, Fishing;Forestry;1003
A210;A2.10;4;Silviculture and other forestry activities;Agriculture, Forestry, Fishing;Forestry;1003
A22;A2.2;3;Logging;Agriculture, Forestry, Fishing;Forestry;1003
A220;A2.20;4;Logging;Agriculture, Forestry, Fishing;Forestry;1003
A23;A2.3;3;Gathering of wild growing non-wood products;Agriculture, Forestry, Fishing;Forestry;1003
A230;A2.30;4;Gathering of wild growing non-wood products;Agriculture, Forestry, Fishing;Forestry;1003
A24;A2.4;3;Support services to forestry;Agriculture, Forestry, Fishing;Forestry;1003
A240;A2.40;4;Support services to forestry;Agriculture, Forestry, Fishing;Forestry;1003
No Nace;No Nace;No Nace;No Nace;Agriculture, Forestry, Fishing;Other (Agriculture, Forestry, Fishing);1099
B;B;1;Mining and quarrying;Mining and Drilling;;1100
B5;B5;2;Mining of coal and lignite;Mining and Drilling;Mining and Drilling;1101
B51;B5.1;3;Mining of hard coal;Mining and Drilling;Mining and Drilling;1101
B510;B5.10;4;Mining of hard coal;Mining and Drilling;Mining and Drilling;1101
B52;B5.2;3;Mining of lignite;Mining and Drilling;Mining and Drilling;1101
B520;B5.20;4;Mining of lignite;Mining and Drilling;Mining and Drilling;1101
B6;B6;2;Extraction of crude petroleum and natural gas;Mining and Drilling;Mining and Drilling;1101
B61;B6.1;3;Extraction of crude petroleum;Mining and Drilling;Mining and Drilling;1101
B610;B6.10;4;Extraction of crude petroleum;Mining and Drilling;Mining and Drilling;1101
B62;B6.2;3;Extraction of natural gas;Mining and Drilling;Mining and Drilling;1101
B620;B6.20;4;Extraction of natural gas;Mining and Drilling;Mining and Drilling;1101
B7;B7;2;Mining of metal ores;Mining and Drilling;Mining and Drilling;1101
B71;B7.1;3;Mining of iron ores;Mining and Drilling;Mining and Drilling;1101
B710;B7.10;4;Mining of iron ores;Mining and Drilling;Mining and Drilling;1101
B72;B7.2;3;Mining of non-ferrous metal ores;Mining and Drilling;Mining and Drilling;1101
B721;B7.21;4;Mining of uranium and thorium ores;Mining and Drilling;Mining and Drilling;1101
B729;B7.29;4;Mining of other non-ferrous metal ores;Mining and Drilling;Mining and Drilling;1101
B8;B8;2;Other mining and quarrying;Mining and Drilling;Mining and Drilling;1101
B81;B8.1;3;Quarrying of stone, sand and clay;Mining and Drilling;Mining and Drilling;1101
B811;B8.11;4;Quarrying of ornamental and building stone, limestone, gypsum, chalk and slate;Mining and Drilling;Mining and Drilling;1101
B812;B8.12;4;"Operation of gravel and sand pits; mining of clays and kaolin";Mining and Drilling;Mining and Drilling;1101
B89;B8.9;3;Mining and quarrying n.e.c.;Mining and Drilling;Mining and Drilling;1101
B891;B8.91;4;Mining of chemical and fertiliser minerals;Mining and Drilling;Mining and Drilling;1101
B892;B8.92;4;Extraction of peat;Mining and Drilling;Mining and Drilling;1101
B893;B8.93;4;Extraction of salt;Mining and Drilling;Mining and Drilling;1101
B899;B8.99;4;Other mining and quarrying n.e.c.;Mining and Drilling;Mining and Drilling;1101
B9;B9;2;Mining support service activities;Mining and Drilling;Mining and Drilling;1101
B91;B9.1;3;Support activities for petroleum and natural gas extraction;Mining and Drilling;Mining and Drilling;1101
B910;B9.10;4;Support activities for petroleum and natural gas extraction;Mining and Drilling;Mining and Drilling;1101
B99;B9.9;3;Support activities for other mining and quarrying;Mining and Drilling;Mining and Drilling;1101
B990;B9.90;4;Support activities for other mining and quarrying;Mining and Drilling;Mining and Drilling;1101
C2892;C28.92;4;Manufacture of machinery for mining, quarrying and construction;Mining and Drilling;Mining and Drilling;1101
G4672;G46.72;4;Wholesale of metals and metal ores;Mining and Drilling;Mining and Drilling;1101
C2015;C20.15;4;Manufacture of fertilisers and nitrogen compounds;Manufacturing ;"Manufacturing of Agricultural, Forestry and Gardening Supplies
";1201
C202;C20.2;3;Manufacture of pesticides and other agrochemical products;Manufacturing ;"Manufacturing of Agricultural, Forestry and Gardening Supplies
";1201
C2020;C20.20;4;Manufacture of pesticides and other agrochemical products;Manufacturing ;"Manufacturing of Agricultural, Forestry and Gardening Supplies
";1201
C283;C28.3;3;Manufacture of agricultural and forestry machinery;Manufacturing ;"Manufacturing of Agricultural, Forestry and Gardening Supplies
";1201
C2830;C28.30;4;Manufacture of agricultural and forestry machinery;Manufacturing ;"Manufacturing of Agricultural, Forestry and Gardening Supplies
";1201
C19;C19;2;Manufacture of coke and refined petroleum products;Manufacturing ;Manufacturing of Chemicals;1202
C191;C19.1;3;Manufacture of coke oven products;Manufacturing ;Manufacturing of Chemicals;1202
C1910;C19.10;4;Manufacture of coke oven products;Manufacturing ;Manufacturing of Chemicals;1202
C192;C19.2;3;Manufacture of refined petroleum products;Manufacturing ;Manufacturing of Chemicals;1202
C1920;C19.20;4;Manufacture of refined petroleum products;Manufacturing ;Manufacturing of Chemicals;1202
C2011;C20.11;4;Manufacture of industrial gases;Manufacturing ;Manufacturing of Chemicals;1202
C2012;C20.12;4;Manufacture of dyes and pigments;Manufacturing ;Manufacturing of Chemicals;1202
C2013;C20.13;4;Manufacture of other inorganic basic chemicals;Manufacturing ;Manufacturing of Chemicals;1202
C2014;C20.14;4;Manufacture of other organic basic chemicals;Manufacturing ;Manufacturing of Chemicals;1202
C2016;C20.16;4;Manufacture of plastics in primary forms;Manufacturing ;Manufacturing of Chemicals;1202
C2017;C20.17;4;Manufacture of synthetic rubber in primary forms;Manufacturing ;Manufacturing of Chemicals;1202
C203;C20.3;3;Manufacture of paints, varnishes and similar coatings, printing ink and mastics;Manufacturing ;Manufacturing of Chemicals;1202
C2030;C20.30;4;Manufacture of paints, varnishes and similar coatings, printing ink and mastics;Manufacturing ;Manufacturing of Chemicals;1202
C2041;C20.41;4;Manufacture of soap and detergents, cleaning and polishing preparations;Manufacturing ;Manufacturing of Chemicals;1202
C2051;C20.51;4;Manufacture of explosives;Manufacturing ;Manufacturing of Chemicals;1202
C2052;C20.52;4;Manufacture of glues;Manufacturing ;Manufacturing of Chemicals;1202
C2059;C20.59;4;Manufacture of other chemical products n.e.c.;Manufacturing ;Manufacturing of Chemicals;1202
C13;C13;2;Manufacture of textiles;Manufacturing ;Manufacturing of Clothes and Accessories;1203
C131;C13.1;3;Preparation and spinning of textile fibres;Manufacturing ;Manufacturing of Clothes and Accessories;1203
C1310;C13.10;4;Preparation and spinning of textile fibres;Manufacturing ;Manufacturing of Clothes and Accessories;1203
C132;C13.2;3;Weaving of textiles;Manufacturing ;Manufacturing of Clothes and Accessories;1203
C1320;C13.20;4;Weaving of textiles;Manufacturing ;Manufacturing of Clothes and Accessories;1203
C133;C13.3;3;Finishing of textiles;Manufacturing ;Manufacturing of Clothes and Accessories;1203
C1330;C13.30;4;Finishing of textiles;Manufacturing ;Manufacturing of Clothes and Accessories;1203
C139;C13.9;3;Manufacture of other textiles;Manufacturing ;Manufacturing of Clothes and Accessories;1203
C1391;C13.91;4;Manufacture of knitted and crocheted fabrics;Manufacturing ;Manufacturing of Clothes and Accessories;1203
C1392;C13.92;4;Manufacture of made-up textile articles, except apparel;Manufacturing ;Manufacturing of Clothes and Accessories;1203
C1393;C13.93;4;Manufacture of carpets and rugs;Manufacturing ;Manufacturing of Clothes and Accessories;1203
C1394;C13.94;4;Manufacture of cordage, rope, twine and netting;Manufacturing ;Manufacturing of Clothes and Accessories;1203
C1395;C13.95;4;Manufacture of non-wovens and articles made from non;Manufacturing ;Manufacturing of Clothes and Accessories;1203
C1396;C13.96;4;Manufacture of other technical and industrial textiles;Manufacturing ;Manufacturing of Clothes and Accessories;1203
C1399;C13.99;4;Manufacture of other textiles n.e.c.;Manufacturing ;Manufacturing of Clothes and Accessories;1203
C14;C14;2;Manufacture of wearing apparel;Manufacturing ;Manufacturing of Clothes and Accessories;1203
C141;C14.1;3;Manufacture of wearing apparel, except fur apparel;Manufacturing ;Manufacturing of Clothes and Accessories;1203
C1411;C14.11;4;Manufacture of leather Clothes and Accessories;Manufacturing ;Manufacturing of Clothes and Accessories;1203
C1412;C14.12;4;Manufacture of workwear;Manufacturing ;Manufacturing of Clothes and Accessories;1203
C1413;C14.13;4;Manufacture of other outerwear;Manufacturing ;Manufacturing of Clothes and Accessories;1203
C1414;C14.14;4;Manufacture of underwear;Manufacturing ;Manufacturing of Clothes and Accessories;1203
C1419;C14.19;4;Manufacture of other wearing apparel and accessories;Manufacturing ;Manufacturing of Clothes and Accessories;1203
C142;C14.2;3;Manufacture of articles of fur;Manufacturing ;Manufacturing of Clothes and Accessories;1203
C1420;C14.20;4;Manufacture of articles of fur;Manufacturing ;Manufacturing of Clothes and Accessories;1203
C143;C14.3;3;Manufacture of knitted and crocheted apparel;Manufacturing ;Manufacturing of Clothes and Accessories;1203
C1431;C14.31;4;Manufacture of knitted and crocheted hosiery;Manufacturing ;Manufacturing of Clothes and Accessories;1203
C1439;C14.39;4;Manufacture of other knitted and crocheted apparel;Manufacturing ;Manufacturing of Clothes and Accessories;1203
C15;C15;2;Manufacture of leather and related products;Manufacturing ;Manufacturing of Clothes and Accessories;1203
C151;C15.1;3;"Tanning and dressing of leather; manufacture of luggage, handbags, saddlery and harness; dressing and dyeing of fur";Manufacturing ;Manufacturing of Clothes and Accessories;1203
C1511;C15.11;4;"Tanning and dressing of leather; dressing and dyeing of fur";Manufacturing ;Manufacturing of Clothes and Accessories;1203
C1512;C15.12;4;Manufacture of luggage, handbags and the like, saddlery and harness;Manufacturing ;Manufacturing of Clothes and Accessories;1203
C152;C15.2;3;Manufacture of footwear;Manufacturing ;Manufacturing of Clothes and Accessories;1203
C1520;C15.20;4;Manufacture of footwear;Manufacturing ;Manufacturing of Clothes and Accessories;1203
C206;C20.6;3;Manufacture of man-made fibres;Manufacturing ;Manufacturing of Clothes and Accessories;1203
C2060;C20.60;4;Manufacture of man-made fibres;Manufacturing ;Manufacturing of Clothes and Accessories;1203
C2652;C26.52;4;Manufacture of watches and clocks;Manufacturing ;Manufacturing of Clothes and Accessories;1203
C2894;C28.94;4;Manufacture of machinery for textile, apparel and leather production;Manufacturing ;Manufacturing of Clothes and Accessories;1203
C321;C32.1;3;Manufacture of jewellery, bijouterie and related articles;Manufacturing ;Manufacturing of Clothes and Accessories;1203
C3212;C32.12;4;Manufacture of jewellery and related articles;Manufacturing ;Manufacturing of Clothes and Accessories;1203
C3213;C32.13;4;Manufacture of imitation jewellery and related articles;Manufacturing ;Manufacturing of Clothes and Accessories;1203
C265;C26.5;3;"Manufacture of instruments and appliances for measuring, testing and navigation; watches and clocks";Manufacturing ;"Manufacturing of Computer, Electronic and Optical Products
";1204
C2651;C26.51;4;Manufacture of instruments and appliances for measuring, testing and navigation;Manufacturing ;"Manufacturing of Computer, Electronic and Optical Products
";1204
C267;C26.7;3;Manufacture of optical instruments and photographic equipment;Manufacturing ;"Manufacturing of Computer, Electronic and Optical Products
";1204
C2670;C26.70;4;Manufacture of optical instruments and photographic equipment;Manufacturing ;"Manufacturing of Computer, Electronic and Optical Products
";1204
C268;C26.8;3;Manufacture of magnetic and optical media;Manufacturing ;"Manufacturing of Computer, Electronic and Optical Products
";1204
C2680;C26.80;4;Manufacture of magnetic and optical media;Manufacturing ;"Manufacturing of Computer, Electronic and Optical Products
";1204
C2711;C27.11;4;Manufacture of electric motors, generators and transformers;Manufacturing ;"Manufacturing of Computer, Electronic and Optical Products
";1204
C272;C27.2;3;Manufacture of batteries and accumulators;Manufacturing ;"Manufacturing of Computer, Electronic and Optical Products
";1204
C2720;C27.20;4;Manufacture of batteries and accumulators;Manufacturing ;"Manufacturing of Computer, Electronic and Optical Products
";1204
C273;C27.3;3;Manufacture of wiring and wiring devices;Manufacturing ;"Manufacturing of Computer, Electronic and Optical Products
";1204
C2731;C27.31;4;Manufacture of fibre optic cables;Manufacturing ;"Manufacturing of Computer, Electronic and Optical Products
";1204
C2732;C27.32;4;Manufacture of other electronic and electric wires and cables;Manufacturing ;"Manufacturing of Computer, Electronic and Optical Products
";1204
C2733;C27.33;4;Manufacture of wiring devices;Manufacturing ;"Manufacturing of Computer, Electronic and Optical Products
";1204
C279;C27.9;3;Manufacture of other electrical equipment;Manufacturing ;"Manufacturing of Computer, Electronic and Optical Products
";1204
C2790;C27.90;4;Manufacture of other electrical equipment;Manufacturing ;"Manufacturing of Computer, Electronic and Optical Products
";1204
C161;C16.1;3;Sawmilling and planing of wood;Manufacturing ;Manufacturing of Construction Products;1205
C1610;C16.10;4;Sawmilling and planing of wood;Manufacturing ;Manufacturing of Construction Products;1205
C1621;C16.21;4;Manufacture of veneer sheets and wood-based panels;Manufacturing ;Manufacturing of Construction Products;1205
C1622;C16.22;4;Manufacture of assembled parquet floors;Manufacturing ;Manufacturing of Construction Products;1205
C1623;C16.23;4;Manufacture of other builders' carpentry and joinery;Manufacturing ;Manufacturing of Construction Products;1205
C1724;C17.24;4;Manufacture of wallpaper;Manufacturing ;Manufacturing of Construction Products;1205
C2223;C22.23;4;Manufacture of builders’ ware of plastic;Manufacturing ;Manufacturing of Construction Products;1205
C233;C23.3;3;Manufacture of clay building materials;Manufacturing ;Manufacturing of Construction Products;1205
C2331;C23.31;4;Manufacture of ceramic tiles and flags;Manufacturing ;Manufacturing of Construction Products;1205
C2332;C23.32;4;Manufacture of bricks, tiles and construction products, in baked clay;Manufacturing ;Manufacturing of Construction Products;1205
C2342;C23.42;4;Manufacture of ceramic sanitary fixtures;Manufacturing ;Manufacturing of Construction Products;1205
C2343;C23.43;4;Manufacture of ceramic insulators and insulating fittings;Manufacturing ;Manufacturing of Construction Products;1205
C235;C23.5;3;Manufacture of cement, lime and plaster;Manufacturing ;Manufacturing of Construction Products;1205
C2351;C23.51;4;Manufacture of cement;Manufacturing ;Manufacturing of Construction Products;1205
C2352;C23.52;4;Manufacture of lime and plaster;Manufacturing ;Manufacturing of Construction Products;1205
C236;C23.6;3;Manufacture of articles of concrete, cement and plaster;Manufacturing ;Manufacturing of Construction Products;1205
C2361;C23.61;4;Manufacture of concrete products for construction purposes;Manufacturing ;Manufacturing of Construction Products;1205
C2362;C23.62;4;Manufacture of plaster products for construction purposes;Manufacturing ;Manufacturing of Construction Products;1205
C2363;C23.63;4;Manufacture of ready-mixed concrete;Manufacturing ;Manufacturing of Construction Products;1205
C2364;C23.64;4;Manufacture of mortars;Manufacturing ;Manufacturing of Construction Products;1205
C2365;C23.65;4;Manufacture of fibre cement;Manufacturing ;Manufacturing of Construction Products;1205
C2369;C23.69;4;Manufacture of other articles of concrete, plaster and cement;Manufacturing ;Manufacturing of Construction Products;1205
C237;C23.7;3;Cutting, shaping and finishing of stone;Manufacturing ;Manufacturing of Construction Products;1205
C2370;C23.70;4;Cutting, shaping and finishing of stone;Manufacturing ;Manufacturing of Construction Products;1205
C2512;C25.12;4;Manufacture of doors and windows of metal;Manufacturing ;Manufacturing of Construction Products;1205
C2521;C25.21;4;Manufacture of central heating radiators and boilers;Manufacturing ;Manufacturing of Construction Products;1205
C2572;C25.72;4;Manufacture of locks and hinges;Manufacturing ;Manufacturing of Construction Products;1205
C274;C27.4;3;Manufacture of electric lighting equipment;Manufacturing ;Manufacturing of Construction Products;1205
C2740;C27.40;4;Manufacture of electric lighting equipment;Manufacturing ;Manufacturing of Construction Products;1205
C2824;C28.24;4;Manufacture of power-driven hand tools;Manufacturing ;Manufacturing of Construction Products;1205
C2825;C28.25;4;Manufacture of non-domestic cooling and ventilation equipment;Manufacturing ;Manufacturing of Construction Products;1205
C10;C10;2;Manufacture of food products;Manufacturing ;Manufacturing of Food Products;1206
C101;C10.1;3;Processing and preserving of meat and production of meat products;Manufacturing ;Manufacturing of Food Products;1206
C1011;C10.11;4;Processing and preserving of meat;Manufacturing ;Manufacturing of Food Products;1206
C1012;C10.12;4;Processing and preserving of poultry meat;Manufacturing ;Manufacturing of Food Products;1206
C1013;C10.13;4;Production of meat and poultry meat products;Manufacturing ;Manufacturing of Food Products;1206
C102;C10.2;3;Processing and preserving of fish, crustaceans and molluscs;Manufacturing ;Manufacturing of Food Products;1206
C1020;C10.20;4;Processing and preserving of fish, crustaceans and molluscs;Manufacturing ;Manufacturing of Food Products;1206
C103;C10.3;3;Processing and preserving of fruit and vegetables;Manufacturing ;Manufacturing of Food Products;1206
C1031;C10.31;4;Processing and preserving of potatoes;Manufacturing ;Manufacturing of Food Products;1206
C1032;C10.32;4;Manufacture of fruit and vegetable juice;Manufacturing ;Manufacturing of Food Products;1206
C1039;C10.39;4;Other processing and preserving of fruit and vegetables;Manufacturing ;Manufacturing of Food Products;1206
C104;C10.4;3;Manufacture of vegetable and animal oils and fats;Manufacturing ;Manufacturing of Food Products;1206
C1041;C10.41;4;Manufacture of oils and fats;Manufacturing ;Manufacturing of Food Products;1206
C1042;C10.42;4;Manufacture of margarine and similar edible fats;Manufacturing ;Manufacturing of Food Products;1206
C105;C10.5;3;Manufacture of dairy products;Manufacturing ;Manufacturing of Food Products;1206
C1051;C10.51;4;Operation of dairies and cheese making;Manufacturing ;Manufacturing of Food Products;1206
C1052;C10.52;4;Manufacture of ice cream;Manufacturing ;Manufacturing of Food Products;1206
C106;C10.6;3;Manufacture of grain mill products, starches and starch products;Manufacturing ;Manufacturing of Food Products;1206
C1061;C10.61;4;Manufacture of grain mill products;Manufacturing ;Manufacturing of Food Products;1206
C1062;C10.62;4;Manufacture of starches and starch products;Manufacturing ;Manufacturing of Food Products;1206
C107;C10.7;3;Manufacture of bakery and farinaceous products;Manufacturing ;Manufacturing of Food Products;1206
C1071;C10.71;4;"Manufacture of bread; manufacture of fresh pastry goods and cakes";Manufacturing ;Manufacturing of Food Products;1206
C1072;C10.72;4;"Manufacture of rusks and biscuits; manufacture of preserved pastry goods and cakes";Manufacturing ;Manufacturing of Food Products;1206
C1073;C10.73;4;Manufacture of macaroni, noodles, couscous and similar farinaceous products;Manufacturing ;Manufacturing of Food Products;1206
C108;C10.8;3;Manufacture of other food products;Manufacturing ;Manufacturing of Food Products;1206
C1081;C10.81;4;Manufacture of sugar;Manufacturing ;Manufacturing of Food Products;1206
C1082;C10.82;4;Manufacture of cocoa, chocolate and sugar confectionery;Manufacturing ;Manufacturing of Food Products;1206
C1083;C10.83;4;Processing of tea and coffee;Manufacturing ;Manufacturing of Food Products;1206
C1084;C10.84;4;Manufacture of condiments and seasonings;Manufacturing ;Manufacturing of Food Products;1206
C1085;C10.85;4;Manufacture of prepared meals and dishes;Manufacturing ;Manufacturing of Food Products;1206
C1086;C10.86;4;Manufacture of homogenised food preparations and dietetic food;Manufacturing ;Manufacturing of Food Products;1206
C1089;C10.89;4;Manufacture of other food products n.e.c.;Manufacturing ;Manufacturing of Food Products;1206
C109;C10.9;3;Manufacture of prepared animal feeds;Manufacturing ;Manufacturing of Food Products;1206
C1091;C10.91;4;Manufacture of prepared feeds for farm animals;Manufacturing ;Manufacturing of Food Products;1206
C1092;C10.92;4;Manufacture of prepared pet foods;Manufacturing ;Manufacturing of Food Products;1206
C11;C11;2;Manufacture of beverages;Manufacturing ;Manufacturing of Food Products;1206
C110;C11.0;3;Manufacture of beverages;Manufacturing ;Manufacturing of Food Products;1206
C1101;C11.01;4;Distilling, rectifying and blending of spirits;Manufacturing ;Manufacturing of Food Products;1206
C1102;C11.02;4;Manufacture of wine from grape;Manufacturing ;Manufacturing of Food Products;1206
C1103;C11.03;4;Manufacture of cider and other fruit wines;Manufacturing ;Manufacturing of Food Products;1206
C1104;C11.04;4;Manufacture of other non-distilled fermented beverages;Manufacturing ;Manufacturing of Food Products;1206
